P26:
 CREATE TABLE Rides (
    ->     id INT PRIMARY KEY,
    ->     driver_id INT,
    ->     passenger_id INT,
    ->     start_location VARCHAR(255),
    ->     end_location VARCHAR(255),
    ->     distance DECIMAL(5,2),
    ->     ride_time DECIMAL(5,2),
    ->     fare DECIMAL(6,2)
    -> );
Query OK, 0 rows affected (0.02 sec)

P27:
INSERT INTO Rides (id, driver_id, passenger_id, start_location, end_location, distance, ride_time, fare)
    -> VALUES
    ->   (1, 1, 2, 'Location A', 'Location B', 5.2, 15.5, 12.50),
    ->   (2, 3, 4, 'Location C', 'Location D', 3.7, 10.2, 8.75),
    ->   (3, 2, 1, 'Location E', 'Location F', 8.1, 20.8, 15.80),
    ->   (4, 4, 2, 'Location G', 'Location H', 2.5, 7.3, 6.25),
    ->   (5, 1, 3, 'Location I', 'Location J', 6.3, 17.1, 13.20);
Query OK, 5 rows affected (0.01 sec)
Records: 5  Duplicates: 0  Warnings: 0

P28:
 SELECT * FROM Rides ORDER BY  Fare DESC
    -> ;
+----+-----------+--------------+----------------+--------------+----------+-----------+-------+
| id | driver_id | passenger_id | start_location | end_location | distance | ride_time | fare  |
+----+-----------+--------------+----------------+--------------+----------+-----------+-------+
|  3 |         2 |            1 | Location E     | Location F   |     8.10 |     20.80 | 15.80 |
|  5 |         1 |            3 | Location I     | Location J   |     6.30 |     17.10 | 13.20 |
|  1 |         1 |            2 | Location A     | Location B   |     5.20 |     15.50 | 12.50 |
|  2 |         3 |            4 | Location C     | Location D   |     3.70 |     10.20 |  8.75 |
|  4 |         4 |            2 | Location G     | Location H   |     2.50 |      7.30 |  6.25 |
+----+-----------+--------------+----------------+--------------+----------+-----------+-------+
5 rows in set (0.00 sec)


P29:
SELECT SUM(distance) AS total_distance, SUM(fare) AS total_fare FROM Rides;
+----------------+------------+
| total_distance | total_fare |
+----------------+------------+
|          25.80 |      56.50 |
+----------------+------------+
1 row in set (0.00 sec)

p30:
SELECT AVG(ride_time) AS average_ride_time FROM Rides;
+-------------------+
| average_ride_time |
+-------------------+
|         14.180000 |
+-------------------+
1 row in set (0.00 sec)

P31:
SELECT * FROM Rides WHERE start_location LIKE '%Downtown%' OR end_location LIKE '%Downtown%';
Empty set (0.00 sec)

P32:
SELECT COUNT(*) AS ride_count FROM Rides WHERE driver_id = 5;
+------------+
| ride_count |
+------------+
|          0 |
+------------+
1 row in set (0.00 sec)

P33:
UPDATE Rides SET fare = 15 WHERE id = 4;
Query OK, 1 row affected (0.01 sec)
Rows matched: 1  Changed: 1  Warnings: 0;

P34:
SELECT driver_id, SUM(fare) AS total_fare FROM Rides GROUP BY driver_id;
+-----------+------------+
| driver_id | total_fare |
+-----------+------------+
|         1 |      25.70 |
|         3 |       8.75 |
|         2 |      15.80 |
|         4 |      15.00 |
+-----------+------------+
4 rows in set (0.01 sec)

P35:
DELETE FROM Rides WHERE id = 2;
Query OK, 1 row affected (0.01 sec)

